tweet,label
CDM tournament finals were amazing ??,positive
Loved the gameplay in CDM today,positive
CODM tournament was really exciting,positive
That match was intense and fun to watch,positive
Great performance by players in CDM,positive
Best CODM tournament so far,positive
Enjoyed every moment of the CDM finals,positive
Amazing teamwork in CODM match,positive
That clutch play was insane ??,positive
Loved watching the CDM stream,positive
CODM esports scene is growing strong,positive
Fantastic gameplay in tournament today,positive
Really impressed with CDM players,positive
What a comeback in that match,positive
CODM tournament was well organized,positive
Exciting match till the last second,positive
Players showed great skills,positive
Loved the energy of the tournament,positive
Great coordination by teams,positive
That sniper shot was perfect,positive
Best gaming experience watching CDM,positive
Amazing strategies used in match,positive
Loved the competitive spirit,positive
CODM matches are getting better,positive
That was a thrilling game,positive
Players gave their best performance,positive
CDM finals were worth watching,positive
Great execution of plans,positive
Loved the gameplay mechanics,positive
Highly entertaining tournament,positive
Watching CDM match now,neutral
CODM tournament is live today,neutral
Match starting in few minutes,neutral
Team A vs Team B in CDM,neutral
Checking out CODM gameplay stream,neutral
Following CDM tournament updates,neutral
Players are ready for next match,neutral
CODM event happening today,neutral
Waiting for finals to begin,neutral
Just opened CODM stream,neutral
New tournament announced,neutral
Schedule for CDM released,neutral
Match is ongoing now,neutral
Teams are warming up,neutral
CODM gameplay looks normal,neutral
Watching casually,neutral
Just checking the match,neutral
Game is running fine,neutral
No strong opinion on match,neutral
Average gameplay so far,neutral
Nothing special in this match,neutral
Just another CODM game,neutral
Players are playing okay,neutral
Match going on as expected,neutral
Tournament is decent,neutral
CODM event is okay,neutral
Watching highlights now,neutral
Game feels normal,neutral
Just observing gameplay,neutral
Nothing exciting yet,neutral
Too much lag in CDM match,negative
Worst gameplay experience today,negative
CODM servers are bad,negative
Match was boring and slow,negative
Horrible performance by team,negative
Game lag ruined everything,negative
Worst tournament ever,negative
Players made too many mistakes,negative
Gameplay was disappointing,negative
Not enjoying CODM anymore,negative
Terrible match quality,negative
Unfair gameplay in tournament,negative
Bad coordination by players,negative
That was a poor performance,negative
Game glitches everywhere,negative
Frustrating experience watching CDM,negative
Match was not interesting,negative
CODM needs improvement,negative
Bad network ruined match,negative
Gameplay felt very slow,negative
